{
  "schema_version": 1,
  "run_id": "01K1RISKRUN",
  "run_signature": "sha256:aaaaaaaaaaaaaaaaaaaaaaaaaaaaaaaaaaaaaaaaaaaaaaaaaaaaaaaaaaaaaaaa",
  "trace_id": "01K1ABCXYZ",
  "dataset": {
    "dataset_id": "SHFE.AO2609.5m",
    "data_revision": "sha256:1111111111111111111111111111111111111111111111111111111111111111"
  },
  "range": {"warmup_from_bar_index": 0, "from_bar_index": 100, "to_bar_index": 17016},
  "strategy": {
    "strategy_id": "ma20_retest_short",
    "version": "1.0.0",
    "source_hash": "sha256:3333333333333333333333333333333333333333333333333333333333333333",
    "parameters": {"ma_period": 20, "touch_tolerance_ticks": 1, "max_retest_bars": 20},
    "indicator_dependencies": [
      {
        "algorithm_id": "ma",
        "version": "1.0.0",
        "source_hash": "sha256:2222222222222222222222222222222222222222222222222222222222222222"
      }
    ]
  },
  "risk_overlay": {
    "algorithm": {
      "kind": "risk_filter",
      "algorithm_id": "unified_risk_execution_overlay",
      "algorithm_version": "1.0.0",
      "source_hash": "sha256:ffffffffffffffffffffffffffffffffffffffffffffffffffffffffffffffff"
    },
    "parameters": {
      "leverage_allowed": false,
      "leverage_approval_id": "",
      "max_position_weight_ppm": 100000,
      "max_sector_weight_ppm": 300000,
      "max_order_loss_weight_ppm": 10000,
      "stress_loss_per_contract_i64": 100000,
      "max_daily_loss_ppm": 20000,
      "max_strategy_drawdown_ppm": 150000,
      "max_order_participation_ppm": 100000,
      "max_stale_bars": 0,
      "max_data_gap_bars": 0,
      "max_open_signal_age_bars": 3,
      "event_risk_max_position_weight_ppm": 50000,
      "kill_switch_on_data_revision": true
    },
    "context": {
      "market_state_revision": "sha256:eeeeeeeeeeeeeeeeeeeeeeeeeeeeeeeeeeeeeeeeeeeeeeeeeeeeeeeeeeeeeeee",
      "sector_id": "nonferrous",
      "legal_future_branches": ["retest_reclaimed", "retest_failed"],
      "handled_future_branches": ["retest_reclaimed", "retest_failed"],
      "observations": [
        {
          "effective_from_bar_index": 0,
          "available_at_bar_index": 0,
          "data_revision": "sha256:1111111111111111111111111111111111111111111111111111111111111111",
          "trading_status": "normal",
          "stale_bars": 0,
          "data_gap_bars": 0,
          "event_risk_active": false
        }
      ]
    }
  },
  "execution": {
    "signal_timing": "bar_close",
    "fill_timing": "next_bar_open",
    "commission": {"mode": "fixed_per_contract", "amount_i64": 300, "money_scale": 100},
    "slippage": {"mode": "ticks", "value": 1},
    "contract_multiplier": 20,
    "margin_ratio": 0.12,
    "intrabar_conflict_rule": "worst_case"
  },
  "capital": {"initial_cash_i64": 100000000, "currency": "CNY", "money_scale": 100},
  "engine": {"engine_version": "1.0.0", "python_version": "3.14", "contract_version": "1.0.0"},
  "random_seed": 20260801,
  "created_at": "2026-08-21T00:00:00Z"
}
