{
  "schema_version": 1,
  "run_id": "01K1RUNXYZ",
  "run_signature": "sha256:aaaaaaaaaaaaaaaaaaaaaaaaaaaaaaaaaaaaaaaaaaaaaaaaaaaaaaaaaaaaaaaa",
  "trace_id": "01K1ABCXYZ",
  "dataset": {
    "dataset_id": "SHFE.AO2609.5m",
    "data_revision": "sha256:1111111111111111111111111111111111111111111111111111111111111111"
  },
  "range": {
    "warmup_from_bar_index": 0,
    "from_bar_index": 100,
    "to_bar_index": 17016
  },
  "strategy": {
    "strategy_id": "ma20_retest_short",
    "version": "1.0.0",
    "source_hash": "sha256:3333333333333333333333333333333333333333333333333333333333333333",
    "parameters": {
      "ma_period": 20,
      "touch_tolerance_ticks": 1
    },
    "indicator_dependencies": [
      {
        "algorithm_id": "ma",
        "version": "1.0.0",
        "source_hash": "sha256:2222222222222222222222222222222222222222222222222222222222222222"
      }
    ]
  },
  "execution": {
    "signal_timing": "bar_close",
    "fill_timing": "next_bar_open",
    "commission": {
      "mode": "fixed_per_contract",
      "amount_i64": 300,
      "money_scale": 100
    },
    "slippage": {
      "mode": "ticks",
      "value": 1
    },
    "contract_multiplier": 20,
    "margin_ratio": 0.12,
    "intrabar_conflict_rule": "worst_case"
  },
  "capital": {
    "initial_cash_i64": 100000000,
    "currency": "CNY",
    "money_scale": 100
  },
  "engine": {
    "engine_version": "1.0.0",
    "python_version": "3.14",
    "contract_version": "1.0.0"
  },
  "random_seed": 20260801,
  "created_at": "2026-08-01T10:00:00Z"
}

